{
  "build": {
    "classOutputDir": "target/classes",
    "compileOk": true,
    "diagnostics": [],
    "fileCount": 4,
    "sourceCount": 1
  },
  "capability": "build-test.run",
  "classification": "match",
  "comparison": {
    "actualLength": 34,
    "actualSha256": "a3701fd0f135513db0bbc1eb429f1741782c1b3265c9502a9511e07ad03a33ec",
    "expectedLength": 34,
    "expectedSha256": "a3701fd0f135513db0bbc1eb429f1741782c1b3265c9502a9511e07ad03a33ec",
    "matched": true,
    "normalisation": "trim+crlf-to-lf"
  },
  "diagnostics": [],
  "execution": {
    "durationMs": 3,
    "exitCode": 0,
    "ok": true,
    "ran": true,
    "stderr": "",
    "stdout": "APPROVED-COUNT=2\nREJECTED-COUNT=2\n",
    "stdoutSha256": "a3701fd0f135513db0bbc1eb429f1741782c1b3265c9502a9511e07ad03a33ec"
  },
  "goldenMaster": {
    "classification": "synthetic",
    "expected": "APPROVED-COUNT=2\nREJECTED-COUNT=2\n",
    "expectedSha256": "a3701fd0f135513db0bbc1eb429f1741782c1b3265c9502a9511e07ad03a33ec",
    "knownDivergenceAtW0": false,
    "source": "corpus/synthetic/fixtures/branch-account-guard-output.txt"
  },
  "outputRef": {
    "byteSize": 1342,
    "kind": "build-test-result",
    "mimeType": "application/json",
    "sha256": "9b0a8c0c025feea05a6636471b245f6a2fe8c5c979c987d7d64103c4cab5e6a3",
    "uri": "urn:build-test-runner-service/build-test-result/9b0a8c0c025feea05a6636471b245f6a2fe8c5c979c987d7d64103c4cab5e6a3"
  },
  "programId": "BRNCH01",
  "runId": "run-1",
  "schemaVersion": "v0",
  "service": "build-test-runner-service",
  "sourceRef": {},
  "status": "ok",
  "summary": "Generated stdout matched Golden Master.",
  "tests": {
    "failed": 0,
    "note": "W0 generator does not emit JUnit tests yet; the runner only exercises compile + main() execution against a Golden Master.",
    "passed": 0,
    "ran": false,
    "skipped": 0,
    "totalTests": 0
  },
  "workflowId": "w0-migration-v0"
}
